{
  "receipt_version": 1,
  "plan": {
    "plan_id": "t-a1",
    "step_id": "archive",
    "repo": "trained-assist/software-engineering-playbooks",
    "issue": "issue#135"
  },
  "requirements": {
    "ref": "issue#135",
    "revision": "@2",
    "accepted_at": "2026-10-04T11:33:48Z"
  },
  "code_delivery": {
    "state": "merged",
    "refs": [
      "pr:https://github.com/trained-assist/software-engineering-playbooks/pull/131",
      "sha:b8115fc27c4259d278eec03594d83515808d45f3"
    ]
  },
  "baseline": {
    "state": "pending",
    "reason": "docs ride a separate follow-up PR, opened after merge (issue#47)"
  },
  "delta": [
    {
      "kind": "ADDED",
      "requirement_id": "R-135-1",
      "requirement_ref": "issue#135#Работа-2",
      "behavior_change": true,
      "target": {
        "kind": "spec",
        "path": "docs/user-scenarios/spec-reconciliation.md"
      },
      "source": {
        "commit": "b8115fc27c4259d278eec03594d83515808d45f3",
        "deployed": false
      },
      "evidence_refs": [
        "pr:131"
      ],
      "applied": false
    }
  ],
  "missing_requirements": [
    {
      "requirement_id": "R-135-1",
      "reason": "docs PR not merged yet",
      "followup_ref": "pr:132"
    }
  ],
  "followups": [
    {
      "ref": "pr:132",
      "why": "docs follow-up after merge"
    }
  ],
  "conflicts": []
}
